id,name,campaign_id,description,number_of_participants
1,Marketing for Hunger & Food Insecurity Laos,1,Marketing for Hunger & Food Insecurity Laos Event/Donation Drive,2
2,Event Management for Hunger & Food Insecurity Laos,1,Event Management  Hunger & Food Insecurity Laos Event/Donation Drive,1
3,Marketing for Clean Earth Mumbai,3,Marketing for Clean Earth Mumbai,2
4,Event Management for Clean Earth Mumbai,3,Event Management for Clean Earth Mumbai,1
5,Marketing for Clean Earth LA,5,Marketing for Clean Earth LA Event/Donation Drive,2